<?xml version="1.0" encoding="euc-kr" standalone="no"?>
<!DOCTYPE superEntry SYSTEM "2007pron.dtd">
<superEntry>
	<orth>저이</orth>
	<entry pos="np">
		<mnt_grp>
			<cre>
				<cre_date>2000/08/28</cre_date>
				<cre_writer>호정은</cre_writer>
			</cre>
			<mod>
				<mod_date>2001/10/22</mod_date>
				<mod_writer>호정은</mod_writer>
			</mod>
			<mod>
				<mod_date>2003/06/10</mod_date>
				<mod_writer>김종인</mod_writer>
			</mod>
			<mod>
				<mod_date>2006/12/01</mod_date>
				<mod_writer>호정은</mod_writer>
				<mod_note>새 태그 세트에 맞추어 수정</mod_note>
			</mod>
			<note>2001/10/22(호정은)</note>
			<note>2001년 모형에 맞게 수정</note>
		</mnt_grp>
		<morph_grp>
			<str type="etc">저+이</str>
		</morph_grp>
		<sense n="1" sem="3" num="singular" ref="human">
			<sem_grp>
				<eg>~랑 일해 본 적이 있는데 아주 꼼꼼한 사람이더군요</eg>
			</sem_grp>
			<syn_grp>
				<pre_d yn="no"/>
				<pre_n yn="no"/>
			</syn_grp>
		</sense>
		<sense n="2" sem="3" num="singular" ref="human">
			<sem_grp>
				<eg>~가 오늘 왜 저러지?</eg>
				<trans>husband</trans>
				<reg>구어</reg>
				<lr>
					<rel>남편</rel>
				</lr>
			</sem_grp>
			<syn_grp>
				<pre_d yn="no"/>
				<pre_n yn="no"/>
			</syn_grp>
		</sense>
	</entry>
</superEntry>
