<?xml version="1.0" encoding="euc-kr" standalone="no"?>
<!DOCTYPE superEntry SYSTEM "2007pron.dtd">
<superEntry>
	<orth>후자</orth>
	<entry pos="np">
		<mnt_grp>
			<cre>
				<cre_date>2001/09/09</cre_date>
				<cre_writer>호정은</cre_writer>
			</cre>
			<mod>
				<mod_date>2001/10/09</mod_date>
				<mod_writer>호정은</mod_writer>
			</mod>
			<mod>
				<mod_date>2003/07/05</mod_date>
				<mod_writer>김종인</mod_writer>
			</mod>
			<mod>
				<mod_date>2006/12/01</mod_date>
				<mod_writer>호정은</mod_writer>
				<mod_note>새 태그 세트에 맞추어 수정</mod_note>
			</mod>
		</mnt_grp>
		<morph_grp>
			<org lg="si">後者</org>
					<hom exist="yes"/>
		</morph_grp>
		<sense n="1" sem="3" num="singular" ref="thing">
			<sem_grp>
				<eg>사람에 따라서는 전자만이 문학의 문제요 ~는 문학 외적인 문제라고 주장한다</eg>
				<trans>the latter</trans>
				<reg>문어</reg>
				<lr>
					<ant type="etc">전자</ant>
				</lr>
			</sem_grp>
			<syn_grp>
				<pre_d yn="no"/>
				<pre_n yn="no"/>
			</syn_grp>
		</sense>
	</entry>
</superEntry>
