<?xml version="1.0" encoding="euc-kr" standalone="no"?>
<!DOCTYPE superEntry SYSTEM "2007pron.dtd">
<superEntry>
	<orth>니네</orth>
	<entry pos="np">
		<mnt_grp>
			<cre>
				<cre_date>2001/07/22</cre_date>
				<cre_writer>호정은</cre_writer>
			</cre>
			<mod>
				<mod_date>2001/07/26</mod_date>
				<mod_writer>호정은</mod_writer>
			</mod>
			<mod>
				<mod_date>2003/06/30</mod_date>
				<mod_writer>김종인</mod_writer>
			</mod>
		</mnt_grp>
		<see>너네</see>
		<sense n="1">
		</sense>
	</entry>
</superEntry>
